<?xml version="1.0" encoding="UTF-8"?>
<campusServices 
    xmlns="http://u24666981/campusServices"
    xmlns:xsi="http://www.w3.org/2001/XMLSchema-instance"
    xsi:schemaLocation="http://u24666981/campusServices campus_services.xsd"
    university="University of Pretoria" 
    campus="Hatfield" 
    lastUpdated="2026-04-08">
    <!-- Motheo Morena u24666981-->

    <service id="UP001" category="Academic Support">
        <name>Student Support and Academic Development</name>
        <location>IT Building, Level 3</location>
        <contact>
            <email>studentsupport@up.ac.za</email>
            <phone>012-420-4111</phone>
        </contact>
        <hours>
            <day name="Monday">
                <opens>08:00:00</opens>
                <closes>16:30:00</closes>
            </day>
            <day name="Tuesday">
                <opens>08:00:00</opens>
                <closes>16:30:00</closes>
            </day>
            <day name="Wednesday">
                <opens>08:00:00</opens>
                <closes>16:30:00</closes>
            </day>
            <day name="Thursday">
                <opens>08:00:00</opens>
                <closes>16:30:00</closes>
            </day>
            <day name="Friday">
                <opens>08:00:00</opens>
                <closes>15:00:00</closes>
            </day>
        </hours>
        <description>
            Provides academic development programmes, learning support, and referrals to counselling services for registered students.
        </description>
        <tags>
            <tag>Academic</tag>
            <tag>Support</tag>
            <tag>Development</tag>
        </tags>
    </service>

    <service id="UP002" category="Administration">
        <name>Student Administration</name>
        <location>Client Service Centre, Hatfield Campus</location>
        <contact>
            <email>studentadmin@up.ac.za</email>
            <phone>012-420-3111</phone>
        </contact>
        <hours>
            <day name="Monday">
                <opens>08:30:00</opens>
                <closes>16:00:00</closes>
            </day>
            <day name="Tuesday">
                <opens>08:30:00</opens>
                <closes>16:00:00</closes>
            </day>
            <day name="Wednesday">
                <opens>08:30:00</opens>
                <closes>16:00:00</closes>
            </day>
            <day name="Thursday">
                <opens>08:30:00</opens>
                <closes>16:00:00</closes>
            </day>
            <day name="Friday">
                <opens>08:30:00</opens>
                <closes>14:00:00</closes>
            </day>
        </hours>
        <description>
            Assists students with registrations, academic records, examinations, and general administrative queries.
        </description>
        <tags>
            <tag>Administration</tag>
            <tag>Records</tag>
            <tag>Registrations</tag>
        </tags>
    </service>

    <service id="UP003" category="Health">
        <name>Campus Health Services</name>
        <location>Student Centre, Building 2</location>
        <contact>
            <email>health@up.ac.za</email>
            <phone>012-420-3456</phone>
        </contact>
        <hours>
            <day name="Monday">
                <opens>08:00:00</opens>
                <closes>16:00:00</closes>
            </day>
            <day name="Tuesday">
                <opens>08:00:00</opens>
                <closes>16:00:00</closes>
            </day>
            <day name="Wednesday">
                <opens>08:00:00</opens>
                <closes>16:00:00</closes>
            </day>
            <day name="Thursday">
                <opens>08:00:00</opens>
                <closes>16:00:00</closes>
            </day>
            <day name="Friday">
                <opens>08:00:00</opens>
                <closes>15:00:00</closes>
            </day>
        </hours>
        <description>
            Offers primary healthcare services, health education, and wellness support to University of Pretoria students.
        </description>
        <tags>
            <tag>Health</tag>
            <tag>Wellness</tag>
            <tag>Healthcare</tag>
        </tags>
    </service>

<service id="UP004" category="Security">
        <name>Campus Security &amp; Emergency</name>
        <location>Administration Building, Entrance 1</location>
        <contact>
            <email>security@up.ac.za</email>
            <phone>012-420-2310</phone>
        </contact>
        <hours>
            <day name="Monday"><opens>00:00:00</opens><closes>23:59:00</closes></day>
            <day name="Tuesday"><opens>00:00:00</opens><closes>23:59:00</closes></day>
            <day name="Wednesday"><opens>00:00:00</opens><closes>23:59:00</closes></day>
            <day name="Thursday"><opens>00:00:00</opens><closes>23:59:00</closes></day>
            <day name="Friday"><opens>00:00:00</opens><closes>23:59:00</closes></day>
        </hours>
        <description>24-hour emergency response, campus patrols, and lost and found services.</description>
        <tags>
            <tag>Emergency</tag>
            <tag>24-Hour</tag>
            <tag>Safety</tag>
        </tags>
    </service>

    <service id="UP006" category="Transport">
        <name>Bus Service Office</name>
        <location>Information Building, Room 2-4</location>
        <contact>
            <email>transport@up.ac.za</email>
            <phone>012-420-2530</phone>
        </contact>
        <hours>
            <day name="Monday"><opens>07:30:00</opens><closes>16:00:00</closes></day>
            <day name="Tuesday"><opens>07:30:00</opens><closes>16:00:00</closes></day>
            <day name="Wednesday"><opens>07:30:00</opens><closes>16:00:00</closes></day>
            <day name="Thursday"><opens>07:30:00</opens><closes>16:00:00</closes></day>
            <day name="Friday"><opens>07:30:00</opens><closes>15:30:00</closes></day>
        </hours>
        <description>Coordinates inter-campus shuttle services and park-and-ride permits.</description>
        <tags>
            <tag>Shuttle</tag>
            <tag>Parking</tag>
            <tag>Inter-campus</tag>
        </tags>
    </service>
</campusServices>